{
  "schema_version": 1,
  "packet_id": "evidence-graph-routing-valid",
  "repository": {
    "identity": "git:file:///E:/working-skill-repo",
    "root": ".",
    "vcs": "git",
    "revision": "abc123fixture",
    "dirty_fingerprint": "tracked-dirty-fixture",
    "worktree_fingerprint": "main:abc123fixture:tracked-dirty-fixture",
    "freshness": "fresh",
    "freshness_explanation": "Fixture revision matches the packet inputs."
  },
  "seeds": {
    "files": ["cmd/kbcheck/main.go", ".github/skills/kb-map/SKILL.md"],
    "symbols": [
      {
        "id": "cmd/kbcheck.run",
        "name": "run",
        "kind": "function",
        "span": {"path": "cmd/kbcheck/main.go", "start_line": 164, "end_line": 260}
      }
    ]
  },
  "edges": [
    {
      "from": "cmd/kbcheck.run",
      "to": "internal/graphrouting.Validate",
      "type": "calls",
      "evidence": "exact",
      "confidence": "exact",
      "provenance": "file-native source inspection",
      "span": {"path": "cmd/kbcheck/main.go", "start_line": 190, "end_line": 230},
      "limitations": [],
      "load_bearing": true,
      "metadata": {"provider": "file-native", "query": "registered command dispatch"}
    },
    {
      "from": ".github/skills/kb-map/SKILL.md",
      "to": ".github/skills/kb-map/references/graph-routing.md",
      "type": "documents",
      "evidence": "observed",
      "confidence": "high",
      "provenance": "skill reference text",
      "span": {"path": ".github/skills/kb-map/SKILL.md", "start_line": 96, "end_line": 105},
      "limitations": [],
      "load_bearing": true,
      "metadata": {"provider": "file-native", "query": "reference pointer"}
    },
    {
      "from": "docs/context/PROJECT.md",
      "to": ".token-master/graph.json",
      "type": "may-point-to",
      "evidence": "structural",
      "confidence": "medium",
      "provenance": "documented graph_route contract",
      "span": {"path": "docs/context/PROJECT.md", "start_line": 1, "end_line": 2},
      "limitations": ["Fixture span is illustrative; runtime packets must cite exact source lines."],
      "load_bearing": false,
      "metadata": {"provider": "file-native", "query": "graph_route row"}
    }
  ],
  "direct_impact": [
    {
      "path": "cmd/kbcheck/main.go",
      "symbol": "run",
      "reason": "Registers the packet validator command.",
      "confidence": "high",
      "edges": ["cmd/kbcheck.run->internal/graphrouting.Validate"]
    }
  ],
  "reverse_impact": [
    {
      "path": ".github/skills/kb-map/references/graph-routing.md",
      "reason": "Documents the packet fields and fallback rule consumed by kb-map.",
      "confidence": "medium",
      "edges": [".github/skills/kb-map/SKILL.md->.github/skills/kb-map/references/graph-routing.md"]
    }
  ],
  "tests": ["internal/graphrouting/contract_test.go", "cmd/kbcheck/graph_route_test.go"],
  "docs": [".github/skills/kb-map/references/graph-routing.md"],
  "fallback": {
    "mode": "file-native",
    "reason": "No optional provider is required for the accepted packet."
  },
  "budget": {
    "max_edges": 64,
    "max_bytes": 12000,
    "truncated": false
  },
  "limitations": ["Fixture packet proves the contract shape, not complete repository coverage."],
  "generated_by": "kbcheck graph-route fixture",
  "generated_at": "2026-07-19T00:00:00Z"
}
